{
  "$schema": "./component_graph.schema.json",
  "version": "0.2.0",
  "status": "required",
  "modes": ["pr", "merge_group", "main", "nightly"],
  "targets": [
    "admin",
    "capture_freshness",
    "contracts",
    "docs",
    "firestore_rules",
    "flutter",
    "flutter_build_android",
    "flutter_build_ios",
    "flutter_build_web",
    "flutter_web_smoke",
    "functions",
    "marketing",
    "operations",
    "policy_docs",
    "tools",
    "visual_integration"
  ],
  "ciCheckout": {
    "planner": {
      "mode": "sparse",
      "fetchDepth": 0,
      "coneMode": false,
      "timeoutMinutes": 3,
      "paths": [
        "/tool/harness.mjs",
        "/tool/harness/verify_local.mjs",
        "/tool/harness/compare_selectors.mjs",
        "/tool/ci/toolchain.env",
        "/tool/harness/component_graph.json",
        "/tool/harness/lib/component_graph.mjs",
        "/tool/harness/lib/git_changes.mjs",
        "/tool/harness/lib/workflow_steps.mjs",
        "/tool/lib/path_glob.mjs",
        "/tool/lib/repo_paths.mjs",
        "/tool/lib/repository_snapshot.mjs",
        "/tool/lib/tool_impact.mjs",
        "/tool/lib/tool_platform.mjs",
        "/tool/run.mjs",
        "/tool/tools_manifest.json",
        "/.github/actions/load-toolchain/action.yml",
        "/tool/design/build_host_feature_responsibilities.mjs",
        "/design/features/host_feature_responsibilities.json"
      ]
    },
    "default": {
      "mode": "full",
      "fetchDepth": 0,
      "timeoutMinutes": 3
    },
    "targetOverrides": {
      "docs": {
        "mode": "sparse",
        "fetchDepth": 0,
        "coneMode": false,
        "timeoutMinutes": 3,
        "paths": [
          "/tool/docs/check_doc_metadata.mjs"
        ]
      }
    }
  },
  "operationProfiles": {
    "capture-freshness": {
      "direct": {
        "pr": {"ciTargets": ["capture_freshness"]},
        "merge_group": {"ciTargets": ["capture_freshness"]},
        "main": {"ciTargets": ["capture_freshness"]},
        "nightly": {"ciTargets": ["capture_freshness"]}
      },
      "affected": {
        "pr": {"ciTargets": ["capture_freshness"]},
        "merge_group": {"ciTargets": ["capture_freshness"]},
        "main": {"ciTargets": ["capture_freshness"]},
        "nightly": {"ciTargets": ["capture_freshness"]}
      }
    },
    "ci-workflow-capture": {
      "direct": {
        "pr": {"ciTargets": ["capture_freshness", "policy_docs"], "checkIds": ["agent:harness-v2", "meta:enforcement-integrity"]},
        "merge_group": {"ciTargets": ["capture_freshness", "policy_docs"], "checkIds": ["agent:harness-v2", "meta:enforcement-integrity"]},
        "main": {"ciTargets": ["capture_freshness", "policy_docs"], "checkIds": ["agent:harness-v2", "meta:enforcement-integrity"]},
        "nightly": {"ciTargets": ["capture_freshness", "policy_docs"], "checkIds": ["agent:harness-v2", "meta:enforcement-integrity"]}
      },
      "affected": {}
    },
    "design-todo-decisions": {"direct": {"pr": {"ciTargets": ["docs", "tools"], "checkIds": ["design:comprehensive-todo-summary"]}, "merge_group": {"ciTargets": ["docs", "tools"], "checkIds": ["design:comprehensive-todo-summary"]}, "main": {"ciTargets": ["docs", "tools"], "checkIds": ["design:comprehensive-todo-summary"]}, "nightly": {"ciTargets": ["docs", "tools"], "checkIds": ["design:comprehensive-todo-summary"]}}, "affected": {}},
    "contracts-generated-flutter": {
      "direct": {
        "pr": {"ciTargets": ["contracts", "flutter"]},
        "merge_group": {"ciTargets": ["contracts", "flutter"]},
        "main": {"ciTargets": ["contracts", "flutter"]},
        "nightly": {"ciTargets": ["contracts", "flutter"]}
      },
      "affected": {}
    },
    "contracts-generated-functions": {
      "direct": {
        "pr": {"ciTargets": ["contracts", "firestore_rules", "functions"]},
        "merge_group": {"ciTargets": ["contracts", "firestore_rules", "functions"]},
        "main": {"ciTargets": ["contracts", "firestore_rules", "functions"]},
        "nightly": {"ciTargets": ["contracts", "firestore_rules", "functions"]}
      },
      "affected": {}
    },
    "contracts-generated-admin": {
      "direct": {
        "pr": {"ciTargets": ["admin", "contracts"]},
        "merge_group": {"ciTargets": ["admin", "contracts"]},
        "main": {"ciTargets": ["admin", "contracts"]},
        "nightly": {"ciTargets": ["admin", "contracts"]}
      },
      "affected": {
        "pr": {"ciTargets": ["admin", "contracts"]},
        "merge_group": {"ciTargets": ["admin", "contracts"]},
        "main": {"ciTargets": ["admin", "contracts"]},
        "nightly": {"ciTargets": ["admin", "contracts"]}
      }
    },
    "contracts-generated-marketing": {
      "direct": {
        "pr": {"ciTargets": ["capture_freshness", "contracts", "marketing"]},
        "merge_group": {"ciTargets": ["capture_freshness", "contracts", "marketing"]},
        "main": {"ciTargets": ["capture_freshness", "contracts", "marketing"]},
        "nightly": {"ciTargets": ["capture_freshness", "contracts", "marketing"]}
      },
      "affected": {
        "pr": {"ciTargets": ["capture_freshness", "contracts", "marketing"]},
        "merge_group": {"ciTargets": ["capture_freshness", "contracts", "marketing"]},
        "main": {"ciTargets": ["capture_freshness", "contracts", "marketing"]},
        "nightly": {"ciTargets": ["capture_freshness", "contracts", "marketing"]}
      }
    },
    "contracts-generated-tools": {
      "direct": {
        "pr": {"ciTargets": ["contracts", "tools"]},
        "merge_group": {"ciTargets": ["contracts", "tools"]},
        "main": {"ciTargets": ["contracts", "tools"]},
        "nightly": {"ciTargets": ["contracts", "tools"]}
      },
      "affected": {}
    },
    "docs": {
      "direct": {
        "pr": {"ciTargets": ["docs"], "checkIds": ["docs:metadata"]},
        "merge_group": {"ciTargets": ["docs"], "checkIds": ["docs:metadata"]},
        "main": {"ciTargets": ["docs"], "checkIds": ["docs:metadata"]},
        "nightly": {"ciTargets": ["docs"], "checkIds": ["docs:metadata"]}
      },
      "affected": {}
    },
    "policy": {
      "direct": {
        "pr": {"ciTargets": ["policy_docs"], "checkIds": ["docs:metadata", "meta:enforcement-integrity"]},
        "merge_group": {"ciTargets": ["policy_docs"], "checkIds": ["docs:metadata", "meta:enforcement-integrity"]},
        "main": {"ciTargets": ["policy_docs"], "checkIds": ["docs:metadata", "meta:enforcement-integrity"]},
        "nightly": {"ciTargets": ["policy_docs"], "checkIds": ["docs:metadata", "meta:enforcement-integrity"]}
      },
      "affected": {}
    },
    "harness-full": {
      "direct": {
        "pr": {"ciTargets": ["admin", "capture_freshness", "contracts", "docs", "firestore_rules", "flutter", "flutter_build_android", "flutter_build_ios", "flutter_build_web", "flutter_web_smoke", "functions", "marketing", "operations", "policy_docs", "tools", "visual_integration"], "checkIds": ["agent:harness-v2"]},
        "merge_group": {"ciTargets": ["admin", "capture_freshness", "contracts", "docs", "firestore_rules", "flutter", "flutter_build_android", "flutter_build_ios", "flutter_build_web", "flutter_web_smoke", "functions", "marketing", "operations", "policy_docs", "tools", "visual_integration"], "checkIds": ["agent:harness-v2"]},
        "main": {"ciTargets": ["admin", "capture_freshness", "contracts", "docs", "firestore_rules", "flutter", "flutter_build_android", "flutter_build_ios", "flutter_build_web", "flutter_web_smoke", "functions", "marketing", "operations", "policy_docs", "tools", "visual_integration"], "checkIds": ["agent:harness-v2"]},
        "nightly": {"ciTargets": ["admin", "capture_freshness", "contracts", "docs", "firestore_rules", "flutter", "flutter_build_android", "flutter_build_ios", "flutter_build_web", "flutter_web_smoke", "functions", "marketing", "operations", "policy_docs", "tools", "visual_integration"], "checkIds": ["agent:harness-v2"]}
      },
      "affected": {}
    },
    "backend-delivery-control": {
      "direct": {
        "pr": {"ciTargets": ["contracts", "firestore_rules", "functions", "policy_docs", "tools"], "checkIds": ["agent:harness-v2", "ci:delivery-core", "firebase:affected-function-targets"]},
        "merge_group": {"ciTargets": ["contracts", "firestore_rules", "functions", "policy_docs", "tools"], "checkIds": ["agent:harness-v2", "ci:delivery-core", "firebase:affected-function-targets"]},
        "main": {"ciTargets": ["contracts", "firestore_rules", "functions", "policy_docs", "tools"], "checkIds": ["agent:harness-v2", "ci:delivery-core", "firebase:affected-function-targets"]},
        "nightly": {"ciTargets": ["contracts", "firestore_rules", "functions", "policy_docs", "tools"], "checkIds": ["agent:harness-v2", "ci:delivery-core", "firebase:affected-function-targets"]}
      },
      "affected": {}
    },
    "ci-workflow-app-builds": {
      "direct": {
        "pr": {"ciTargets":["flutter_build_android","flutter_build_ios","flutter_build_web","flutter_web_smoke","policy_docs","tools"],"buildTargets":["consumer-android","consumer-ios","consumer-web","host-android","host-ios","host-web"],"checkIds":["agent:harness-v2","meta:enforcement-integrity","env:ci-toolchain"]},
        "merge_group": {"ciTargets":["flutter_build_android","flutter_build_ios","flutter_build_web","flutter_web_smoke","policy_docs","tools"],"buildTargets":["consumer-android","consumer-ios","consumer-web","host-android","host-ios","host-web"],"checkIds":["agent:harness-v2","meta:enforcement-integrity","env:ci-toolchain"]},
        "main": {"ciTargets":["flutter_build_android","flutter_build_ios","flutter_build_web","flutter_web_smoke","policy_docs","tools"],"buildTargets":["consumer-android","consumer-ios","consumer-web","host-android","host-ios","host-web"],"checkIds":["agent:harness-v2","meta:enforcement-integrity","env:ci-toolchain"]},